{
  "version": 1,
  "task_id": "demo-scene-001",
  "type": "scene.render",
  "priority": 80,
  "ttl_ms": 10000,
  "interrupt": "replace",
  "duration_ms": 5000,
  "created_at": "2026-07-24T10:00:00Z",
  "scene": {
    "text": {
      "content": "我在想啦。",
      "style": "devil_thinking"
    },
    "animation": {
      "asset_id": "devil_thinking",
      "asset_version": 1,
      "loop": 1
    }
  }
}
