{
  "version": 1,
  "task_id": "demo-image-001",
  "type": "scene.render",
  "priority": 50,
  "ttl_ms": 10000,
  "interrupt": "replace",
  "duration_ms": 5000,
  "created_at": "2026-07-24T10:00:00Z",
  "scene": {
    "image": {
      "asset_id": "devil_low_battery",
      "asset_version": 1
    }
  }
}
