{
  "version": 1,
  "task_id": "demo-animation-001",
  "type": "scene.render",
  "priority": 50,
  "ttl_ms": 10000,
  "interrupt": "replace",
  "duration_ms": 3000,
  "created_at": "2026-07-24T10:00:00Z",
  "scene": {
    "animation": {
      "asset_id": "devil_wave",
      "asset_version": 1,
      "loop": 2
    }
  }
}
